{
  "id": "aae-vector-12",
  "name": "Signing-authority mismatch \u2014 signing DID != issuer",
  "description": "Non-delegated AAE whose issuer is the registry but whose JWS is signed by a different DID's key.",
  "section_ref": "draft-kroehl-agentic-trust-aae-00 \u00a75 step 1 (signing authority)",
  "input": {
    "secured_aae": "eyJhbGciOiJFZERTQSIsImN0eSI6ImFhZStqc29uIiwia2lkIjoiZGlkOndlYjpleGFtcGxlLmNvbTphZ2VudC1hI2tleS0xIn0.eyJAY29udGV4dCI6WyJodHRwczovL3d3dy53My5vcmcvbnMvY3JlZGVudGlhbHMvdjIiLCJodHRwczovL21vbHRydXN0LmNoL2NvbnRleHRzL2FhZS92MSJdLCJ0eXBlIjpbIlZlcmlmaWFibGVDcmVkZW50aWFsIiwiQWdlbnRBdXRob3JpemF0aW9uRW52ZWxvcGUiXSwiaWQiOiJ1cm46dXVpZDowMDAwMDAwYy0wMDAwLTQwMDAtODAwMC0wMDAwMDAwMDAwMGMiLCJpc3N1ZXIiOiJkaWQ6d2ViOmV4YW1wbGUuY29tOnJlZ2lzdHJ5IiwidmFsaWRGcm9tIjoiMjAyNi0wNS0yMFQwODowMDowMFoiLCJjcmVkZW50aWFsU3ViamVjdCI6eyJpZCI6ImRpZDp3ZWI6ZXhhbXBsZS5jb206YWdlbnQtMDAxIiwiYWFlIjp7Im1hbmRhdGUiOnsiYWN0aW9ucyI6WyJyZWFkIiwiYm9vayIsInBheSJdLCJwdXJwb3NlIjoiQnVzaW5lc3MgdHJhdmVsIGJvb2tpbmciLCJzY29wZSI6InRyYXZlbC12ZXJ0aWNhbCIsInByaW5jaXBhbF9kaWQiOiJkaWQ6d2ViOmV4YW1wbGUuY29tOmVudGVycHJpc2UtY29ycCJ9LCJjb25zdHJhaW50cyI6eyJtYXhfdHJhbnNhY3Rpb25fdmFsdWUiOnsidmFsdWUiOjUwMCwiY3VycmVuY3kiOiJVU0QiLCJyZXF1aXJlZCI6dHJ1ZX19LCJ2YWxpZGl0eSI6eyJub3RfYmVmb3JlIjoiMjAyNi0wNS0yMFQwODowMDowMFoiLCJub3RfYWZ0ZXIiOiIyMDI2LTA1LTIwVDE2OjAwOjAwWiIsInNpbmdsZV91c2UiOmZhbHNlfX19fQ.LF3ONCos43YHvEPgjczGm_0QvHObex9Z6RNaK5CegVyzOVpZdaiSNliFCfq6rcdNB40TWEowB962BQJoFfOwDA",
    "context": {
      "current_time": "2026-05-20T12:00:00Z",
      "requested_action": "book",
      "action_context": {
        "amount": 300,
        "currency": "USD"
      },
      "subject_binding": {
        "challenge_response_valid": true
      }
    }
  },
  "expected": {
    "result": "REJECT",
    "verification_step": 1,
    "rejection_reason": "signing_authority_mismatch"
  },
  "rationale": "Section 5 step 1 requires that for a non-delegated AAE the signing DID be identical to the Verifiable Credential issuer. The signature is cryptographically valid but the signing DID (agent-a) differs from the issuer (registry), so the AAE is rejected at step 1."
}
