{
  "id": "aae-vector-10",
  "name": "Delegation cycle \u2014 repeated AAE id in path",
  "description": "The verification path revisits an AAE id already seen, indicating a cycle.",
  "section_ref": "draft-kroehl-agentic-trust-aae-00 \u00a75 step 9 (cycle detection)",
  "input": {
    "secured_aae": "eyJhbGciOiJFZERTQSIsImN0eSI6ImFhZStqc29uIiwia2lkIjoiZGlkOndlYjpleGFtcGxlLmNvbTphZ2VudC1iI2tleS0xIn0.eyJAY29udGV4dCI6WyJodHRwczovL3d3dy53My5vcmcvbnMvY3JlZGVudGlhbHMvdjIiLCJodHRwczovL21vbHRydXN0LmNoL2NvbnRleHRzL2FhZS92MSJdLCJ0eXBlIjpbIlZlcmlmaWFibGVDcmVkZW50aWFsIiwiQWdlbnRBdXRob3JpemF0aW9uRW52ZWxvcGUiXSwiaWQiOiJ1cm46dXVpZDowMDAwMDAwYS0wMDAwLTQwMDAtODAwMC0wMDAwMDAwMDAwMGEiLCJpc3N1ZXIiOiJkaWQ6d2ViOmV4YW1wbGUuY29tOmFnZW50LWIiLCJ2YWxpZEZyb20iOiIyMDI2LTA1LTIwVDA4OjAwOjAwWiIsImNyZWRlbnRpYWxTdWJqZWN0Ijp7ImlkIjoiZGlkOndlYjpleGFtcGxlLmNvbTphZ2VudC1jIiwiYWFlIjp7Im1hbmRhdGUiOnsiYWN0aW9ucyI6WyJyZWFkIl0sImRlbGVnYXRpb24iOnsiZGVsZWdhdG9yX2RpZCI6ImRpZDp3ZWI6ZXhhbXBsZS5jb206YWdlbnQtYiIsImRlbGVnYXRvcl9hYWVfaWQiOiJ1cm46dXVpZDowMDAwMDAwYS0wMDAwLTQwMDAtODAwMC0wMDAwMDAwMDAwYjEiLCJkZWxlZ2F0b3JfYWFlX3VyaSI6Imh0dHBzOi8vYWFlLmV4YW1wbGUvcC8wMDAwMDAwYS1iMSIsImRlcHRoIjoyLCJtYXhfZGVwdGgiOjJ9fSwiY29uc3RyYWludHMiOnsibWF4X3RyYW5zYWN0aW9uX3ZhbHVlIjp7InZhbHVlIjoxMDAsImN1cnJlbmN5IjoiVVNEIiwicmVxdWlyZWQiOnRydWV9fSwidmFsaWRpdHkiOnsibm90X2JlZm9yZSI6IjIwMjYtMDUtMjBUMDg6MDA6MDBaIiwibm90X2FmdGVyIjoiMjAyNi0wNS0yMFQxNjowMDowMFoiLCJzaW5nbGVfdXNlIjpmYWxzZX19fX0.KPIHo_ECkqCKWEiI2ynFn8ecEWiErXxS6MCKxCs9raddxzZDuL_Z6LkBJRppni_RuU9Ls6W8qhVyCI5f2MJtDQ",
    "context": {
      "current_time": "2026-05-20T12:00:00Z",
      "requested_action": "read",
      "action_context": {
        "amount": 50,
        "currency": "USD"
      },
      "subject_binding": {
        "challenge_response_valid": true
      },
      "delegation_chain": [
        "eyJhbGciOiJFZERTQSIsImN0eSI6ImFhZStqc29uIiwia2lkIjoiZGlkOndlYjpleGFtcGxlLmNvbTpyZWdpc3RyeSNrZXktMSJ9.eyJAY29udGV4dCI6WyJodHRwczovL3d3dy53My5vcmcvbnMvY3JlZGVudGlhbHMvdjIiLCJodHRwczovL21vbHRydXN0LmNoL2NvbnRleHRzL2FhZS92MSJdLCJ0eXBlIjpbIlZlcmlmaWFibGVDcmVkZW50aWFsIiwiQWdlbnRBdXRob3JpemF0aW9uRW52ZWxvcGUiXSwiaWQiOiJ1cm46dXVpZDowMDAwMDAwYS0wMDAwLTQwMDAtODAwMC0wMDAwMDAwMDAwMGEiLCJpc3N1ZXIiOiJkaWQ6d2ViOmV4YW1wbGUuY29tOnJlZ2lzdHJ5IiwidmFsaWRGcm9tIjoiMjAyNi0wNS0yMFQwODowMDowMFoiLCJjcmVkZW50aWFsU3ViamVjdCI6eyJpZCI6ImRpZDp3ZWI6ZXhhbXBsZS5jb206YWdlbnQtYSIsImFhZSI6eyJtYW5kYXRlIjp7ImFjdGlvbnMiOlsicmVhZCJdLCJwdXJwb3NlIjoiQnVzaW5lc3MgdHJhdmVsIGJvb2tpbmciLCJzY29wZSI6InRyYXZlbC12ZXJ0aWNhbCIsInByaW5jaXBhbF9kaWQiOiJkaWQ6d2ViOmV4YW1wbGUuY29tOmVudGVycHJpc2UtY29ycCIsImRlbGVnYXRpb25fcG9saWN5Ijp7Im1heF9kZXB0aCI6Mn19LCJjb25zdHJhaW50cyI6eyJtYXhfdHJhbnNhY3Rpb25fdmFsdWUiOnsidmFsdWUiOjUwMCwiY3VycmVuY3kiOiJVU0QiLCJyZXF1aXJlZCI6dHJ1ZX19LCJ2YWxpZGl0eSI6eyJub3RfYmVmb3JlIjoiMjAyNi0wNS0yMFQwODowMDowMFoiLCJub3RfYWZ0ZXIiOiIyMDI2LTA1LTIwVDE2OjAwOjAwWiIsInNpbmdsZV91c2UiOmZhbHNlfX19fQ.gytjn6sT3GNFK5-OGz1z56VdDDNpztO4LCeL4BNqaaWIO79pIzmWMZFnvdqmySjwYmbAGKx2RCxomJ4LS_rEBg",
        "eyJhbGciOiJFZERTQSIsImN0eSI6ImFhZStqc29uIiwia2lkIjoiZGlkOndlYjpleGFtcGxlLmNvbTphZ2VudC1hI2tleS0xIn0.eyJAY29udGV4dCI6WyJodHRwczovL3d3dy53My5vcmcvbnMvY3JlZGVudGlhbHMvdjIiLCJodHRwczovL21vbHRydXN0LmNoL2NvbnRleHRzL2FhZS92MSJdLCJ0eXBlIjpbIlZlcmlmaWFibGVDcmVkZW50aWFsIiwiQWdlbnRBdXRob3JpemF0aW9uRW52ZWxvcGUiXSwiaWQiOiJ1cm46dXVpZDowMDAwMDAwYS0wMDAwLTQwMDAtODAwMC0wMDAwMDAwMDAwYjEiLCJpc3N1ZXIiOiJkaWQ6d2ViOmV4YW1wbGUuY29tOmFnZW50LWEiLCJ2YWxpZEZyb20iOiIyMDI2LTA1LTIwVDA4OjAwOjAwWiIsImNyZWRlbnRpYWxTdWJqZWN0Ijp7ImlkIjoiZGlkOndlYjpleGFtcGxlLmNvbTphZ2VudC1iIiwiYWFlIjp7Im1hbmRhdGUiOnsiYWN0aW9ucyI6WyJyZWFkIl0sImRlbGVnYXRpb24iOnsiZGVsZWdhdG9yX2RpZCI6ImRpZDp3ZWI6ZXhhbXBsZS5jb206YWdlbnQtYSIsImRlbGVnYXRvcl9hYWVfaWQiOiJ1cm46dXVpZDowMDAwMDAwYS0wMDAwLTQwMDAtODAwMC0wMDAwMDAwMDAwMGEiLCJkZWxlZ2F0b3JfYWFlX3VyaSI6Imh0dHBzOi8vYWFlLmV4YW1wbGUvcC9jeWNsZSIsImRlcHRoIjoxLCJtYXhfZGVwdGgiOjJ9fSwiY29uc3RyYWludHMiOnsibWF4X3RyYW5zYWN0aW9uX3ZhbHVlIjp7InZhbHVlIjozMDAsImN1cnJlbmN5IjoiVVNEIiwicmVxdWlyZWQiOnRydWV9fSwidmFsaWRpdHkiOnsibm90X2JlZm9yZSI6IjIwMjYtMDUtMjBUMDg6MDA6MDBaIiwibm90X2FmdGVyIjoiMjAyNi0wNS0yMFQxNjowMDowMFoiLCJzaW5nbGVfdXNlIjpmYWxzZX19fX0.Cg-MFDetOo9C6LLOuWVezEWNp12tsCfQnCNb2uqGwpV3m26Ds4laQNkpZ5v7l4u8yxptnA1C7sgR6mxgAlZbCA"
      ]
    }
  },
  "expected": {
    "result": "REJECT",
    "verification_step": 9,
    "rejection_reason": "delegation_cycle_detected"
  },
  "rationale": "Section 5 step 9 requires the relying party to maintain the set of AAE ids visited in the current path and to reject immediately if any id appears more than once. The presented id reappears among the ancestors, so the chain is rejected at step 9."
}
