{
  "id": "aae-vector-09",
  "name": "Delegation depth exceeds max_depth \u2014 reject",
  "description": "Depth-2 delegated AAE declares max_depth 1, so depth exceeds the permitted maximum for the branch.",
  "section_ref": "draft-kroehl-agentic-trust-aae-00 \u00a73 (Delegation depth), \u00a75 step 9",
  "input": {
    "secured_aae": "eyJhbGciOiJFZERTQSIsImN0eSI6ImFhZStqc29uIiwia2lkIjoiZGlkOndlYjpleGFtcGxlLmNvbTphZ2VudC1iI2tleS0xIn0.eyJAY29udGV4dCI6WyJodHRwczovL3d3dy53My5vcmcvbnMvY3JlZGVudGlhbHMvdjIiLCJodHRwczovL21vbHRydXN0LmNoL2NvbnRleHRzL2FhZS92MSJdLCJ0eXBlIjpbIlZlcmlmaWFibGVDcmVkZW50aWFsIiwiQWdlbnRBdXRob3JpemF0aW9uRW52ZWxvcGUiXSwiaWQiOiJ1cm46dXVpZDowMDAwMDAwOS0wMDAwLTQwMDAtODAwMC0wMDAwMDAwMDAwMDkiLCJpc3N1ZXIiOiJkaWQ6d2ViOmV4YW1wbGUuY29tOmFnZW50LWIiLCJ2YWxpZEZyb20iOiIyMDI2LTA1LTIwVDA4OjAwOjAwWiIsImNyZWRlbnRpYWxTdWJqZWN0Ijp7ImlkIjoiZGlkOndlYjpleGFtcGxlLmNvbTphZ2VudC1jIiwiYWFlIjp7Im1hbmRhdGUiOnsiYWN0aW9ucyI6WyJyZWFkIl0sImRlbGVnYXRpb24iOnsiZGVsZWdhdG9yX2RpZCI6ImRpZDp3ZWI6ZXhhbXBsZS5jb206YWdlbnQtYiIsImRlbGVnYXRvcl9hYWVfaWQiOiJ1cm46dXVpZDowMDAwMDAwOS0wMDAwLTQwMDAtODAwMC0wMDAwMDAwMDAwYjkiLCJkZWxlZ2F0b3JfYWFlX3VyaSI6Imh0dHBzOi8vYWFlLmV4YW1wbGUvcC8wMDAwMDAwOS1iOSIsImRlcHRoIjoyLCJtYXhfZGVwdGgiOjF9fSwiY29uc3RyYWludHMiOnsibWF4X3RyYW5zYWN0aW9uX3ZhbHVlIjp7InZhbHVlIjoxMDAsImN1cnJlbmN5IjoiVVNEIiwicmVxdWlyZWQiOnRydWV9fSwidmFsaWRpdHkiOnsibm90X2JlZm9yZSI6IjIwMjYtMDUtMjBUMDg6MDA6MDBaIiwibm90X2FmdGVyIjoiMjAyNi0wNS0yMFQxNjowMDowMFoiLCJzaW5nbGVfdXNlIjpmYWxzZX19fX0.QmsEYoJnVQ23GwnZaDST_P4-zI58FHaaXM0zrsgKqDCtigXIXepXTeqZ-qU4Bn5jOeb51ivQiMBxtRuTqMPIDQ",
    "context": {
      "current_time": "2026-05-20T12:00:00Z",
      "requested_action": "read",
      "action_context": {
        "amount": 50,
        "currency": "USD"
      },
      "subject_binding": {
        "challenge_response_valid": true
      },
      "delegation_chain": [
        "eyJhbGciOiJFZERTQSIsImN0eSI6ImFhZStqc29uIiwia2lkIjoiZGlkOndlYjpleGFtcGxlLmNvbTpyZWdpc3RyeSNrZXktMSJ9.eyJAY29udGV4dCI6WyJodHRwczovL3d3dy53My5vcmcvbnMvY3JlZGVudGlhbHMvdjIiLCJodHRwczovL21vbHRydXN0LmNoL2NvbnRleHRzL2FhZS92MSJdLCJ0eXBlIjpbIlZlcmlmaWFibGVDcmVkZW50aWFsIiwiQWdlbnRBdXRob3JpemF0aW9uRW52ZWxvcGUiXSwiaWQiOiJ1cm46dXVpZDowMDAwMDAwOS0wMDAwLTQwMDAtODAwMC0wMDAwMDAwMDAwYTkiLCJpc3N1ZXIiOiJkaWQ6d2ViOmV4YW1wbGUuY29tOnJlZ2lzdHJ5IiwidmFsaWRGcm9tIjoiMjAyNi0wNS0yMFQwODowMDowMFoiLCJjcmVkZW50aWFsU3ViamVjdCI6eyJpZCI6ImRpZDp3ZWI6ZXhhbXBsZS5jb206YWdlbnQtYSIsImFhZSI6eyJtYW5kYXRlIjp7ImFjdGlvbnMiOlsicmVhZCJdLCJwdXJwb3NlIjoiQnVzaW5lc3MgdHJhdmVsIGJvb2tpbmciLCJzY29wZSI6InRyYXZlbC12ZXJ0aWNhbCIsInByaW5jaXBhbF9kaWQiOiJkaWQ6d2ViOmV4YW1wbGUuY29tOmVudGVycHJpc2UtY29ycCIsImRlbGVnYXRpb25fcG9saWN5Ijp7Im1heF9kZXB0aCI6Mn19LCJjb25zdHJhaW50cyI6eyJtYXhfdHJhbnNhY3Rpb25fdmFsdWUiOnsidmFsdWUiOjUwMCwiY3VycmVuY3kiOiJVU0QiLCJyZXF1aXJlZCI6dHJ1ZX19LCJ2YWxpZGl0eSI6eyJub3RfYmVmb3JlIjoiMjAyNi0wNS0yMFQwODowMDowMFoiLCJub3RfYWZ0ZXIiOiIyMDI2LTA1LTIwVDE2OjAwOjAwWiIsInNpbmdsZV91c2UiOmZhbHNlfX19fQ.mVVbRpB5Ts1b9Am6_SoS2TovFunqpdh1zVgZs2-i1fqjWeaDGHHaMOPNwjXTu5CucIPUJA1iTh8wFOZNkH_0Cg",
        "eyJhbGciOiJFZERTQSIsImN0eSI6ImFhZStqc29uIiwia2lkIjoiZGlkOndlYjpleGFtcGxlLmNvbTphZ2VudC1hI2tleS0xIn0.eyJAY29udGV4dCI6WyJodHRwczovL3d3dy53My5vcmcvbnMvY3JlZGVudGlhbHMvdjIiLCJodHRwczovL21vbHRydXN0LmNoL2NvbnRleHRzL2FhZS92MSJdLCJ0eXBlIjpbIlZlcmlmaWFibGVDcmVkZW50aWFsIiwiQWdlbnRBdXRob3JpemF0aW9uRW52ZWxvcGUiXSwiaWQiOiJ1cm46dXVpZDowMDAwMDAwOS0wMDAwLTQwMDAtODAwMC0wMDAwMDAwMDAwYjkiLCJpc3N1ZXIiOiJkaWQ6d2ViOmV4YW1wbGUuY29tOmFnZW50LWEiLCJ2YWxpZEZyb20iOiIyMDI2LTA1LTIwVDA4OjAwOjAwWiIsImNyZWRlbnRpYWxTdWJqZWN0Ijp7ImlkIjoiZGlkOndlYjpleGFtcGxlLmNvbTphZ2VudC1iIiwiYWFlIjp7Im1hbmRhdGUiOnsiYWN0aW9ucyI6WyJyZWFkIl0sImRlbGVnYXRpb24iOnsiZGVsZWdhdG9yX2RpZCI6ImRpZDp3ZWI6ZXhhbXBsZS5jb206YWdlbnQtYSIsImRlbGVnYXRvcl9hYWVfaWQiOiJ1cm46dXVpZDowMDAwMDAwOS0wMDAwLTQwMDAtODAwMC0wMDAwMDAwMDAwYTkiLCJkZWxlZ2F0b3JfYWFlX3VyaSI6Imh0dHBzOi8vYWFlLmV4YW1wbGUvcC8wMDAwMDAwOS1hOSIsImRlcHRoIjoxLCJtYXhfZGVwdGgiOjF9fSwiY29uc3RyYWludHMiOnsibWF4X3RyYW5zYWN0aW9uX3ZhbHVlIjp7InZhbHVlIjozMDAsImN1cnJlbmN5IjoiVVNEIiwicmVxdWlyZWQiOnRydWV9fSwidmFsaWRpdHkiOnsibm90X2JlZm9yZSI6IjIwMjYtMDUtMjBUMDg6MDA6MDBaIiwibm90X2FmdGVyIjoiMjAyNi0wNS0yMFQxNjowMDowMFoiLCJzaW5nbGVfdXNlIjpmYWxzZX19fX0.DsWIF5IlNjDnMCM8nGBN9pWhJLkShDvgO5A07hmSGK7CkmvolbzfPdAiY4Hvl3afmpxIg_sKImacV_auzpsnDA"
      ]
    }
  },
  "expected": {
    "result": "REJECT",
    "verification_step": 9,
    "rejection_reason": "delegation_depth_exceeded"
  },
  "rationale": "Section 3 requires depth to not exceed max_depth, and \u00a75 step 9 enforces depth limits. The presented AAE has depth 2 with max_depth 1, so it is rejected at step 9."
}
