{
  "id": "aae-vector-06",
  "name": "Valid delegation chain \u2014 depth 2",
  "description": "Depth-2 delegated AAE (agent-c) presented with its ancestor chain (registry->agent-a->agent-b). Subset actions, monotonic value caps, depths within max_depth.",
  "section_ref": "draft-kroehl-agentic-trust-aae-00 \u00a73, \u00a75 step 9",
  "input": {
    "secured_aae": "eyJhbGciOiJFZERTQSIsImN0eSI6ImFhZStqc29uIiwia2lkIjoiZGlkOndlYjpleGFtcGxlLmNvbTphZ2VudC1iI2tleS0xIn0.eyJAY29udGV4dCI6WyJodHRwczovL3d3dy53My5vcmcvbnMvY3JlZGVudGlhbHMvdjIiLCJodHRwczovL21vbHRydXN0LmNoL2NvbnRleHRzL2FhZS92MSJdLCJ0eXBlIjpbIlZlcmlmaWFibGVDcmVkZW50aWFsIiwiQWdlbnRBdXRob3JpemF0aW9uRW52ZWxvcGUiXSwiaWQiOiJ1cm46dXVpZDowMDAwMDAwNi0wMDAwLTQwMDAtODAwMC0wMDAwMDAwMDAwYzIiLCJpc3N1ZXIiOiJkaWQ6d2ViOmV4YW1wbGUuY29tOmFnZW50LWIiLCJ2YWxpZEZyb20iOiIyMDI2LTA1LTIwVDA4OjAwOjAwWiIsImNyZWRlbnRpYWxTdWJqZWN0Ijp7ImlkIjoiZGlkOndlYjpleGFtcGxlLmNvbTphZ2VudC1jIiwiYWFlIjp7Im1hbmRhdGUiOnsiYWN0aW9ucyI6WyJyZWFkIl0sImRlbGVnYXRpb24iOnsiZGVsZWdhdG9yX2RpZCI6ImRpZDp3ZWI6ZXhhbXBsZS5jb206YWdlbnQtYiIsImRlbGVnYXRvcl9hYWVfaWQiOiJ1cm46dXVpZDowMDAwMDAwNi0wMDAwLTQwMDAtODAwMC0wMDAwMDAwMDAwYjEiLCJkZWxlZ2F0b3JfYWFlX3VyaSI6Imh0dHBzOi8vYWFlLmV4YW1wbGUvcC91cm46dXVpZDowMDAwMDAwNi0wMDAwLTQwMDAtODAwMC0wMDAwMDAwMDAwYjEiLCJkZWxlZ2F0b3JfYWFlX2hhc2giOiJzaGEtMjU2OkxOcERXMl84ZEhvS2lSWEhDYVV0eWowWV82WVlIVUJxc2FCWHQ1Y3RlbFUiLCJkZXB0aCI6MiwibWF4X2RlcHRoIjoyfX0sImNvbnN0cmFpbnRzIjp7Im1heF90cmFuc2FjdGlvbl92YWx1ZSI6eyJ2YWx1ZSI6MTAwLCJjdXJyZW5jeSI6IlVTRCIsInJlcXVpcmVkIjp0cnVlfX0sInZhbGlkaXR5Ijp7Im5vdF9iZWZvcmUiOiIyMDI2LTA1LTIwVDA4OjAwOjAwWiIsIm5vdF9hZnRlciI6IjIwMjYtMDUtMjBUMTY6MDA6MDBaIiwic2luZ2xlX3VzZSI6ZmFsc2V9fX19.himfUdrvV9a_jN306OZ6tNRVJ2f2UjFUZHQngvpPwU5dT-IoJ6DYMcLkuOmplQBeTBUyi9f1kSvzjp93xwBfBg",
    "context": {
      "current_time": "2026-05-20T12:00:00Z",
      "requested_action": "read",
      "action_context": {
        "amount": 50,
        "currency": "USD"
      },
      "subject_binding": {
        "challenge_response_valid": true
      },
      "delegation_chain": [
        "eyJhbGciOiJFZERTQSIsImN0eSI6ImFhZStqc29uIiwia2lkIjoiZGlkOndlYjpleGFtcGxlLmNvbTpyZWdpc3RyeSNrZXktMSJ9.eyJAY29udGV4dCI6WyJodHRwczovL3d3dy53My5vcmcvbnMvY3JlZGVudGlhbHMvdjIiLCJodHRwczovL21vbHRydXN0LmNoL2NvbnRleHRzL2FhZS92MSJdLCJ0eXBlIjpbIlZlcmlmaWFibGVDcmVkZW50aWFsIiwiQWdlbnRBdXRob3JpemF0aW9uRW52ZWxvcGUiXSwiaWQiOiJ1cm46dXVpZDowMDAwMDAwNi0wMDAwLTQwMDAtODAwMC0wMDAwMDAwMDAwYTAiLCJpc3N1ZXIiOiJkaWQ6d2ViOmV4YW1wbGUuY29tOnJlZ2lzdHJ5IiwidmFsaWRGcm9tIjoiMjAyNi0wNS0yMFQwODowMDowMFoiLCJjcmVkZW50aWFsU3ViamVjdCI6eyJpZCI6ImRpZDp3ZWI6ZXhhbXBsZS5jb206YWdlbnQtYSIsImFhZSI6eyJtYW5kYXRlIjp7ImFjdGlvbnMiOlsicmVhZCIsImJvb2siLCJwYXkiXSwicHVycG9zZSI6IkJ1c2luZXNzIHRyYXZlbCBib29raW5nIiwic2NvcGUiOiJ0cmF2ZWwtdmVydGljYWwiLCJwcmluY2lwYWxfZGlkIjoiZGlkOndlYjpleGFtcGxlLmNvbTplbnRlcnByaXNlLWNvcnAiLCJkZWxlZ2F0aW9uX3BvbGljeSI6eyJtYXhfZGVwdGgiOjJ9fSwiY29uc3RyYWludHMiOnsibWF4X3RyYW5zYWN0aW9uX3ZhbHVlIjp7InZhbHVlIjo1MDAsImN1cnJlbmN5IjoiVVNEIiwicmVxdWlyZWQiOnRydWV9fSwidmFsaWRpdHkiOnsibm90X2JlZm9yZSI6IjIwMjYtMDUtMjBUMDg6MDA6MDBaIiwibm90X2FmdGVyIjoiMjAyNi0wNS0yMFQxNjowMDowMFoiLCJzaW5nbGVfdXNlIjpmYWxzZX19fX0.bp4mg2g6Hmxq6dsVpMBZd9x1WlJBifF_31xh91UjtJ15BrO4ZkpLRUTQf3J3FqDVkMO_farzlnGzIoZTGfP5Dw",
        "eyJhbGciOiJFZERTQSIsImN0eSI6ImFhZStqc29uIiwia2lkIjoiZGlkOndlYjpleGFtcGxlLmNvbTphZ2VudC1hI2tleS0xIn0.eyJAY29udGV4dCI6WyJodHRwczovL3d3dy53My5vcmcvbnMvY3JlZGVudGlhbHMvdjIiLCJodHRwczovL21vbHRydXN0LmNoL2NvbnRleHRzL2FhZS92MSJdLCJ0eXBlIjpbIlZlcmlmaWFibGVDcmVkZW50aWFsIiwiQWdlbnRBdXRob3JpemF0aW9uRW52ZWxvcGUiXSwiaWQiOiJ1cm46dXVpZDowMDAwMDAwNi0wMDAwLTQwMDAtODAwMC0wMDAwMDAwMDAwYjEiLCJpc3N1ZXIiOiJkaWQ6d2ViOmV4YW1wbGUuY29tOmFnZW50LWEiLCJ2YWxpZEZyb20iOiIyMDI2LTA1LTIwVDA4OjAwOjAwWiIsImNyZWRlbnRpYWxTdWJqZWN0Ijp7ImlkIjoiZGlkOndlYjpleGFtcGxlLmNvbTphZ2VudC1iIiwiYWFlIjp7Im1hbmRhdGUiOnsiYWN0aW9ucyI6WyJyZWFkIiwiYm9vayJdLCJkZWxlZ2F0aW9uIjp7ImRlbGVnYXRvcl9kaWQiOiJkaWQ6d2ViOmV4YW1wbGUuY29tOmFnZW50LWEiLCJkZWxlZ2F0b3JfYWFlX2lkIjoidXJuOnV1aWQ6MDAwMDAwMDYtMDAwMC00MDAwLTgwMDAtMDAwMDAwMDAwMGEwIiwiZGVsZWdhdG9yX2FhZV91cmkiOiJodHRwczovL2FhZS5leGFtcGxlL3AvdXJuOnV1aWQ6MDAwMDAwMDYtMDAwMC00MDAwLTgwMDAtMDAwMDAwMDAwMGEwIiwiZGVsZWdhdG9yX2FhZV9oYXNoIjoic2hhLTI1NjpZdk9pSEJpck5HNTFfcE8ycEhrcGFqblA3eGhsbEZFTmtkZ1N6Zjl2Z1J3IiwiZGVwdGgiOjEsIm1heF9kZXB0aCI6Mn19LCJjb25zdHJhaW50cyI6eyJtYXhfdHJhbnNhY3Rpb25fdmFsdWUiOnsidmFsdWUiOjMwMCwiY3VycmVuY3kiOiJVU0QiLCJyZXF1aXJlZCI6dHJ1ZX19LCJ2YWxpZGl0eSI6eyJub3RfYmVmb3JlIjoiMjAyNi0wNS0yMFQwODowMDowMFoiLCJub3RfYWZ0ZXIiOiIyMDI2LTA1LTIwVDE2OjAwOjAwWiIsInNpbmdsZV91c2UiOmZhbHNlfX19fQ.pQZYEBZ5yGzeMZnS_PFBusPLVFFOUq9DLA2jyztU74AGxhWJZpwQ_oaCjwEZaPToS59FXlZXIQQL9fAm_1s7AQ"
      ]
    }
  },
  "expected": {
    "result": "ACCEPT",
    "verification_step": 9,
    "rejection_reason": null
  },
  "rationale": "Each link satisfies \u00a73: delegated actions are subsets (read,book,pay -> read,book -> read), value caps are monotonically non-increasing (500 -> 300 -> 100 USD, same currency), each parent credentialSubject.id equals the child delegator_did, depths are 0/1/2 within max_depth 2, and each ancestor signature and signing authority verifies (\u00a75 step 9)."
}
